service,block_title,body
completeness-optimization-ai,"Content Completeness Optimization","We optimize content completeness by implementing comprehensive content coverage, explicit completeness markers, and completeness validation. This includes content coverage optimization (comprehensive content coverage, explicit content completeness, content depth indicators), completeness signal enhancement (completeness markers, comprehensive content indicators, completeness validation), and completeness validation (content completeness checks, completeness verification, completeness reporting)."
completeness-optimization-ai,"Completeness Validation & Reporting","We implement comprehensive completeness validation and reporting systems including content completeness checks, completeness verification, and completeness reporting. This includes completeness validation (content completeness checks, completeness verification, completeness reporting), completeness analytics (completeness metrics, completeness trends, completeness insights), and completeness optimization (completeness improvements, completeness enhancements, completeness recommendations)."
completeness-optimization-ai,"AI System Completeness Alignment","We align content with AI system completeness requirements including comprehensive content coverage, explicit completeness markers, and completeness validation. AI systems prioritize certain completeness factors—content coverage (comprehensive content, explicit completeness, content depth), completeness indicators (completeness markers, comprehensive content indicators, completeness validation), and completeness trust (completeness verification, completeness reporting, completeness confidence). We ensure your content maximizes all completeness-critical factors to improve AI system confidence and citation likelihood."
content-optimization-ai,"AI Content Architecture & Structure","We structure content for AI systems by implementing atomic content blocks, explicit entity definitions, and AI citation-ready factual statements. AI systems require clear, unambiguous content structure to generate accurate responses, so we optimize content architecture for maximum AI comprehension and citation likelihood."
content-optimization-ai,"AI Content Optimization & Citation Signals","We optimize content for AI citation by implementing explicit factual statements, verifiable claims, and citation anchors that AI systems use when generating responses. This includes structured fact extraction (explicit 'X is Y' statements, verifiable data points, source attribution), citation anchor implementation (clear source links, verifiable URLs, current information), and content formatting optimized for AI parsing and citation (atomic paragraphs, explicit definitions, clear hierarchies)."
content-optimization-ai,"AI Content Entity Clarity","We optimize content entity clarity for AI systems by implementing explicit entity definitions, clear entity relationships, and unambiguous entity references. This includes entity definition optimization (explicit entity definitions, clear entity relationships, unambiguous entity references), entity relationship clarity (explicit entity relationships, clear entity hierarchies, unambiguous entity connections), and entity disambiguation (explicit entity disambiguation, clear entity distinctions, unambiguous entity identification)."
content-optimization-ai,"Multi-Platform AI Content Optimization","We optimize content for multiple AI platforms (ChatGPT, Claude, Perplexity, Google AI Overviews) by implementing platform-agnostic content patterns and structured data that work across all AI engines. Each system has unique content requirements, so we ensure compatibility across all platforms while maximizing citation likelihood for each system."
contextual-seo-ai,"Contextual Signal Engineering","We engineer contextual signals that improve how AI systems understand and rank your content within specific contexts. This includes contextual relevance markers, context-aware entity definitions, and contextual ranking signals. AI systems use contextual signals to determine content relevance within specific contexts, so we optimize all contextual-critical elements to maximize contextual relevance and ranking position."
contextual-seo-ai,"Contextual Entity & Content Optimization","We optimize contextual entities and content by implementing context-aware entity definitions, contextual content structure, and contextual relevance signals. This includes contextual entity optimization (context-aware entity definitions, contextual entity relationships, context-specific entity references), contextual content structure (context-aware content blocks, contextual content organization, context-specific content patterns), and contextual relevance signals (contextual relevance markers, context-aware ranking signals, context-specific optimization)."
contextual-seo-ai,"Context-Aware Structured Data","We implement context-aware structured data including contextual entity definitions, context-specific structured data, and contextual relevance markers. This includes contextual structured data (context-aware JSON-LD, contextual entity definitions, context-specific markup), contextual entity optimization (context-aware entity definitions, contextual entity relationships, context-specific entity references), and contextual relevance signals (contextual relevance markers, context-aware ranking signals, context-specific optimization)."
contextual-seo-ai,"Multi-Context AI Optimization","We optimize content for multiple contexts and AI platforms by implementing context-aware structured data and content patterns that work across different contexts and AI engines. Each context and system has unique requirements, so we ensure compatibility across all contexts and platforms while maximizing contextual relevance and ranking position for each context and system."
conversational-seo-ai,"Conversational Signal Engineering","We engineer conversational signals that improve how AI systems understand and respond to conversational queries. This includes conversational query patterns, conversational content structure, and conversational response optimization. AI systems use conversational signals to determine content relevance for conversational queries, so we optimize all conversational-critical elements to maximize conversational relevance and response accuracy."
conversational-seo-ai,"Conversational Content Architecture","We structure content for conversational AI systems by implementing conversational content blocks, explicit conversational entity definitions, and conversational response patterns. Conversational AI systems require clear, unambiguous conversational content structure to generate accurate responses, so we optimize conversational content architecture for maximum conversational AI comprehension and response accuracy."
conversational-seo-ai,"Conversational Query & Response Optimization","We optimize content for conversational queries and responses by implementing conversational query patterns, conversational content structure, and conversational response optimization. This includes conversational query analysis (conversational query patterns, conversational intent classification, conversational query-entity matching), conversational content structure (conversational content blocks, conversational content organization, conversational content patterns), and conversational response optimization (conversational response patterns, conversational response structure, conversational response accuracy)."
conversational-seo-ai,"Multi-Platform Conversational Optimization","We optimize content for multiple conversational AI platforms (ChatGPT, Claude, Perplexity, Google AI Overviews) by implementing platform-agnostic conversational content patterns and structured data that work across all conversational AI engines. Each system has unique conversational requirements, so we ensure compatibility across all platforms while maximizing conversational relevance and response accuracy for each system."
conversion-optimization-ai,"AI Conversion Signal Engineering","We engineer AI conversion signals that improve how AI systems drive conversions through your content. This includes conversion-optimized structured data, conversion-focused entity definitions, and conversion signal optimization. AI systems use conversion signals to determine content conversion potential, so we optimize all conversion-critical elements to maximize conversion likelihood and conversion rate."
conversion-optimization-ai,"Conversion-Optimized Content Architecture","We structure content for AI conversion optimization by implementing conversion-optimized content blocks, explicit conversion-focused entity definitions, and conversion-ready content patterns. AI conversion systems require clear, unambiguous conversion-optimized content structure to drive conversions, so we optimize conversion content architecture for maximum AI conversion comprehension and conversion likelihood."
conversion-optimization-ai,"Conversion Signal Optimization","We optimize conversion signals by implementing conversion-optimized structured data, conversion-focused entity definitions, and conversion signal enhancement. This includes conversion structured data (conversion-optimized JSON-LD, conversion-focused entity definitions, conversion-specific markup), conversion entity optimization (conversion-focused entity definitions, conversion entity relationships, conversion-specific entity references), and conversion signal enhancement (conversion signals, conversion markers, conversion optimization)."
conversion-optimization-ai,"Multi-Platform AI Conversion Optimization","We optimize content for AI conversion across multiple platforms (ChatGPT, Claude, Perplexity, Google AI Overviews) by implementing platform-agnostic conversion-optimized content patterns and structured data that work across all AI conversion engines. Each system has unique conversion requirements, so we ensure compatibility across all platforms while maximizing conversion likelihood and conversion rate for each system."
copilot-optimization,"Copilot Signal Engineering","We engineer Copilot signals that improve how Microsoft Copilot includes and cites your content. This includes Copilot-specific structured data, entity clarity optimization, and Copilot citation signals. Microsoft Copilot uses specific signals to determine content inclusion, so we optimize all Copilot-critical elements to maximize inclusion likelihood and citation accuracy."
copilot-optimization,"Copilot Structured Data Implementation","We implement Copilot-specific structured data including comprehensive entity definitions, explicit factual statements, and Copilot citation anchors. This includes entity clarity optimization (explicit entity definitions, clear entity relationships, unambiguous entity references), Copilot citation signals (citation-ready content structure, explicit source attribution, verifiable claims), and Copilot structured data (comprehensive JSON-LD, explicit entity definitions, Copilot-specific markup)."
copilot-optimization,"Copilot Content Architecture","We structure content for Copilot inclusion by implementing atomic content blocks, explicit entity definitions, and Copilot citation-ready factual statements. Copilot requires clear, unambiguous content structure to generate accurate responses, so we optimize content architecture for maximum Copilot comprehension and citation likelihood."
copilot-optimization,"Copilot Entity & Citation Optimization","We optimize entity clarity and citation signals for Copilot inclusion by implementing explicit entity definitions, clear entity relationships, and Copilot citation anchors. This includes entity definition optimization (explicit entity definitions, clear entity relationships, unambiguous entity references), citation signal enhancement (explicit source attribution, verifiable URLs, current information), and Copilot-specific optimization (Copilot-structured data, Copilot citation signals, Copilot entity clarity)."
ecommerce-ai-seo,"E-commerce Entity & Product Optimization","We optimize e-commerce entities and products for AI systems by implementing comprehensive e-commerce-specific structured data, explicit product definitions, and e-commerce entity clarity. This includes e-commerce entity optimization (explicit e-commerce entity definitions, clear e-commerce product relationships, unambiguous e-commerce entity references), e-commerce product clarity (explicit product definitions, clear product relationships, unambiguous product references), and e-commerce structured data (comprehensive e-commerce JSON-LD, explicit e-commerce entity definitions, e-commerce-specific markup)."
ecommerce-ai-seo,"E-commerce Content Architecture & Citation Optimization","We structure e-commerce content for AI systems by implementing atomic e-commerce content blocks, explicit e-commerce entity definitions, and e-commerce citation-ready factual statements. E-commerce AI systems require clear, unambiguous e-commerce content structure to generate accurate responses, so we optimize e-commerce content architecture for maximum e-commerce AI comprehension and citation likelihood."
ecommerce-ai-seo,"E-commerce Product Schema & Entity Mapping","We implement comprehensive e-commerce product schema and entity mapping including Product schema, Brand schema, and e-commerce entity relationships. This includes e-commerce product schema (comprehensive Product JSON-LD, explicit product definitions, product relationships), e-commerce entity mapping (e-commerce entity relationships, e-commerce entity hierarchies, e-commerce entity disambiguation), and e-commerce structured data (comprehensive e-commerce JSON-LD, explicit e-commerce entity definitions, e-commerce-specific markup)."
ecommerce-ai-seo,"E-commerce AI Platform Optimization","We optimize e-commerce content for multiple AI platforms (ChatGPT, Claude, Perplexity, Google AI Overviews) by implementing platform-agnostic e-commerce structured data and content patterns that work across all e-commerce AI engines. Each system has unique e-commerce requirements, so we ensure compatibility across all platforms while maximizing e-commerce citation likelihood for each system."
entity-optimization-ai,"Entity Signal Engineering","We engineer entity signals that improve how AI systems understand and cite your entities. This includes entity clarity optimization, explicit entity definitions, and entity relationship mapping. AI systems use entity signals to determine entity understanding and citation likelihood, so we optimize all entity-critical elements to maximize entity comprehension and citation accuracy."
entity-optimization-ai,"Entity Definition & Clarity Optimization","We optimize entity definitions and clarity by implementing explicit entity definitions, clear entity relationships, and unambiguous entity references. This includes entity definition optimization (explicit entity definitions, clear entity relationships, unambiguous entity references), entity relationship clarity (explicit entity relationships, clear entity hierarchies, unambiguous entity connections), and entity disambiguation (explicit entity disambiguation, clear entity distinctions, unambiguous entity identification)."
entity-optimization-ai,"Entity Graph & Relationship Mapping","We implement comprehensive entity graph and relationship mapping including entity relationships, entity hierarchies, and entity disambiguation. This includes entity graph optimization (entity relationships, entity hierarchies, entity disambiguation), entity relationship mapping (explicit entity relationships, clear entity hierarchies, unambiguous entity connections), and entity structured data (comprehensive entity JSON-LD, explicit entity definitions, entity-specific markup)."
entity-optimization-ai,"Multi-Platform Entity Optimization","We optimize entities across multiple AI platforms (ChatGPT, Claude, Perplexity, Google AI Overviews) by implementing platform-agnostic entity definitions and structured data that work across all AI engines. Each system has unique entity requirements, so we ensure compatibility across all platforms while maximizing entity comprehension and citation accuracy for each system."
explainability-optimization-ai,"Explainability Signal Engineering","We engineer explainability signals that improve how AI systems explain and justify your content. This includes explainability indicators, transparency markers, and explainability validation patterns. AI systems use explainability signals to determine content explainability and trustworthiness, so we optimize all explainability-critical elements to maximize AI system confidence and citation likelihood."
explainability-optimization-ai,"Explainability & Transparency Optimization","We optimize explainability and transparency by implementing explicit explainability markers, transparency indicators, and explainability validation. This includes explainability signal enhancement (explainability markers, transparency indicators, explainability validation), explainability optimization (explicit explainability, clear explanations, transparent reasoning), and explainability validation (explainability checks, explainability verification, explainability reporting)."
explainability-optimization-ai,"Explainability Validation & Reporting","We implement comprehensive explainability validation and reporting systems including explainability checks, explainability verification, and explainability reporting. This includes explainability validation (explainability checks, explainability verification, explainability reporting), explainability analytics (explainability metrics, explainability trends, explainability insights), and explainability optimization (explainability improvements, explainability enhancements, explainability recommendations)."
explainability-optimization-ai,"AI System Explainability Alignment","We align content with AI system explainability requirements including explicit explainability markers, transparency indicators, and explainability validation. AI systems prioritize certain explainability factors—explainability clarity (explicit explanations, clear reasoning, transparent logic), explainability indicators (explainability markers, transparency indicators, explainability validation), and explainability trust (explainability verification, explainability reporting, explainability confidence). We ensure your content maximizes all explainability-critical factors to improve AI system confidence and citation likelihood."
intent-optimization-ai,"Intent Signal Engineering","We engineer intent signals that improve how AI systems understand and match user intent to your content. This includes intent classification markers, intent-aligned content structure, and intent matching optimization. AI systems use intent signals to determine content relevance for specific user intents, so we optimize all intent-critical elements to maximize intent matching and ranking position."
intent-optimization-ai,"Intent Classification & Alignment","We optimize intent classification and alignment by implementing explicit intent markers, intent-aligned content structure, and intent matching optimization. This includes intent classification (explicit intent markers, intent classification, intent alignment), intent-aligned content (intent-aligned content structure, intent-specific content patterns, intent-optimized content), and intent matching (intent matching optimization, intent relevance signals, intent ranking factors)."
intent-optimization-ai,"Intent-Optimized Content Architecture","We structure content for intent optimization by implementing intent-aligned content blocks, explicit intent markers, and intent-optimized content patterns. Intent-optimized AI systems require clear, unambiguous intent-aligned content structure to match user intents, so we optimize intent content architecture for maximum intent matching and ranking position."
intent-optimization-ai,"Multi-Intent AI Optimization","We optimize content for multiple user intents and AI platforms by implementing intent-aligned structured data and content patterns that work across different intents and AI engines. Each intent and system has unique requirements, so we ensure compatibility across all intents and platforms while maximizing intent matching and ranking position for each intent and system."
knowledge-graph,"Knowledge Graph Signal Engineering","We engineer Knowledge Graph signals that improve how Google Knowledge Graph includes and represents your entities. This includes Knowledge Graph-specific structured data, entity clarity optimization, and Knowledge Graph entity signals. Google Knowledge Graph uses specific signals to determine entity inclusion, so we optimize all Knowledge Graph-critical elements to maximize entity inclusion and representation accuracy."
knowledge-graph,"Knowledge Graph Entity Optimization","We optimize entities for Knowledge Graph inclusion by implementing explicit entity definitions, clear entity relationships, and Knowledge Graph entity signals. This includes entity definition optimization (explicit entity definitions, clear entity relationships, unambiguous entity references), Knowledge Graph entity signals (Knowledge Graph-specific structured data, Knowledge Graph entity relationships, Knowledge Graph entity clarity), and Knowledge Graph structured data (comprehensive Knowledge Graph JSON-LD, explicit Knowledge Graph entity definitions, Knowledge Graph-specific markup)."
knowledge-graph,"Knowledge Graph Structured Data Implementation","We implement Knowledge Graph-specific structured data including comprehensive entity definitions, explicit entity relationships, and Knowledge Graph entity signals. This includes Knowledge Graph structured data (comprehensive Knowledge Graph JSON-LD, explicit Knowledge Graph entity definitions, Knowledge Graph-specific markup), Knowledge Graph entity optimization (explicit Knowledge Graph entity definitions, clear Knowledge Graph entity relationships, unambiguous Knowledge Graph entity references), and Knowledge Graph entity signals (Knowledge Graph-specific structured data, Knowledge Graph entity relationships, Knowledge Graph entity clarity)."
knowledge-graph,"Knowledge Graph Entity & Relationship Mapping","We implement comprehensive Knowledge Graph entity and relationship mapping including Knowledge Graph entity relationships, Knowledge Graph entity hierarchies, and Knowledge Graph entity disambiguation. This includes Knowledge Graph entity mapping (Knowledge Graph entity relationships, Knowledge Graph entity hierarchies, Knowledge Graph entity disambiguation), Knowledge Graph entity optimization (explicit Knowledge Graph entity definitions, clear Knowledge Graph entity relationships, unambiguous Knowledge Graph entity references), and Knowledge Graph structured data (comprehensive Knowledge Graph JSON-LD, explicit Knowledge Graph entity definitions, Knowledge Graph-specific markup)."
knowledge-graph-ai,"Knowledge Graph AI Signal Engineering","We engineer Knowledge Graph AI signals that improve how AI systems understand and represent your entities in knowledge graphs. This includes Knowledge Graph AI-specific structured data, entity clarity optimization, and Knowledge Graph AI entity signals. AI knowledge graph systems use specific signals to determine entity inclusion, so we optimize all Knowledge Graph AI-critical elements to maximize entity inclusion and representation accuracy."
knowledge-graph-ai,"Knowledge Graph AI Entity Optimization","We optimize entities for Knowledge Graph AI inclusion by implementing explicit entity definitions, clear entity relationships, and Knowledge Graph AI entity signals. This includes entity definition optimization (explicit entity definitions, clear entity relationships, unambiguous entity references), Knowledge Graph AI entity signals (Knowledge Graph AI-specific structured data, Knowledge Graph AI entity relationships, Knowledge Graph AI entity clarity), and Knowledge Graph AI structured data (comprehensive Knowledge Graph AI JSON-LD, explicit Knowledge Graph AI entity definitions, Knowledge Graph AI-specific markup)."
knowledge-graph-ai,"Knowledge Graph AI Structured Data Implementation","We implement Knowledge Graph AI-specific structured data including comprehensive entity definitions, explicit entity relationships, and Knowledge Graph AI entity signals. This includes Knowledge Graph AI structured data (comprehensive Knowledge Graph AI JSON-LD, explicit Knowledge Graph AI entity definitions, Knowledge Graph AI-specific markup), Knowledge Graph AI entity optimization (explicit Knowledge Graph AI entity definitions, clear Knowledge Graph AI entity relationships, unambiguous Knowledge Graph AI entity references), and Knowledge Graph AI entity signals (Knowledge Graph AI-specific structured data, Knowledge Graph AI entity relationships, Knowledge Graph AI entity clarity)."
knowledge-graph-ai,"Multi-Platform Knowledge Graph AI Optimization","We optimize entities for Knowledge Graph AI across multiple AI platforms (ChatGPT, Claude, Perplexity, Google AI Overviews) by implementing platform-agnostic Knowledge Graph AI structured data and entity definitions that work across all AI knowledge graph engines. Each system has unique Knowledge Graph AI requirements, so we ensure compatibility across all platforms while maximizing entity inclusion and representation accuracy for each system."
