service,block_title,body
accuracy-optimization-ai,"Accuracy Signal Engineering","We engineer accuracy signals that improve how AI systems evaluate and trust your content. This includes fact verification signals, source attribution markers, and accuracy validation patterns. AI systems use accuracy signals to determine content trustworthiness, so we optimize all accuracy-critical elements to maximize AI system confidence and citation likelihood."
accuracy-optimization-ai,"Fact Verification & Source Attribution","We implement comprehensive fact verification systems including explicit source attribution, verifiable claims, and accuracy markers. This includes structured fact extraction (explicit 'X is Y' statements with sources), source attribution implementation (clear source links, verifiable URLs, current information), and accuracy validation (fact checking, source verification, claim substantiation). AI systems cite content with strong accuracy signals more frequently and accurately."
accuracy-optimization-ai,"Content Accuracy Optimization","We optimize content accuracy by implementing explicit factual statements, verifiable claims, and accuracy anchors that AI systems use when evaluating content trustworthiness. This includes accuracy signal enhancement (factual accuracy markers, source credibility indicators, claim verification), content accuracy validation (fact checking, source verification, claim substantiation), and accuracy reporting (accuracy metrics, fact verification status, source attribution)."
accuracy-optimization-ai,"AI System Accuracy Alignment","We align content with AI system accuracy requirements including fact verification, source attribution, and accuracy validation. AI systems prioritize certain accuracy factors—factual accuracy (verifiable facts, current information, accurate data), source credibility (authoritative sources, verifiable URLs, current information), and claim substantiation (evidence-based claims, verifiable statements, accurate representations). We ensure your content maximizes all accuracy-critical factors to improve AI system confidence and citation likelihood."
agentic-seo,"Agentic System Architecture","We structure content for agentic AI systems by implementing agent-compatible endpoints, explicit capability declarations, and agent-actionable structured data. Agentic AI systems require clear, unambiguous content structure to execute actions, so we optimize content architecture for maximum agentic AI comprehension and action execution."
agentic-seo,"Agent Surface Design & API Exposure","We design agent surfaces that expose capabilities and booking flows to AI agents. This includes agent-compatible endpoints (RESTful APIs, structured data endpoints, agent-actionable URLs), explicit capability declarations (service descriptions, action definitions, parameter specifications), and agent-actionable structured data (Service schema with offers, LocalBusiness schema with booking, Product schema with availability)."
agentic-seo,"Agent Action Optimization","We optimize content for agent action execution by implementing explicit action definitions, parameter specifications, and agent-actionable structured data. This includes action definition optimization (clear action descriptions, parameter specifications, return value definitions), agent-actionable structured data (Service schema with offers, LocalBusiness schema with booking, Product schema with availability), and agent surface design (agent-compatible endpoints, explicit capability declarations, agent-actionable URLs)."
agentic-seo,"Multi-Agent System Compatibility","We optimize content for multiple agentic AI systems (ChatGPT Actions, Claude Tools, Perplexity Agents, Google AI Actions) by implementing platform-agnostic structured data and content patterns that work across all agentic engines. Each system has unique requirements, so we ensure compatibility across all platforms while maximizing agent action execution likelihood for each system."
ai-citation-optimization,"Citation Signal Engineering","We engineer citation signals that improve how AI systems cite your content. This includes citation anchor implementation, source attribution markers, and citation trust signals. AI systems use citation signals to determine citation likelihood, so we optimize all citation-critical elements to maximize citation frequency and accuracy."
ai-citation-optimization,"Citation Anchor Implementation","We implement citation anchors that AI systems use when generating citations. This includes explicit citation markers (clear source links, verifiable URLs, current information), citation anchor optimization (citation-ready content structure, explicit source attribution, verifiable claims), and citation trust signals (authoritative sources, verifiable URLs, current information). AI systems cite content with strong citation signals more frequently and accurately."
ai-citation-optimization,"Source Attribution & Verification","We optimize source attribution and verification by implementing explicit source links, verifiable URLs, and current information markers. This includes source attribution enhancement (clear source links, verifiable URLs, current information), source verification (source credibility indicators, verifiable URLs, current information), and source trust signals (authoritative sources, verifiable URLs, current information)."
ai-citation-optimization,"Multi-Platform Citation Optimization","We optimize content for citation across multiple AI platforms (ChatGPT, Claude, Perplexity, Google AI Overviews) by implementing platform-agnostic citation signals and content patterns that work across all AI engines. Each system has unique citation requirements, so we ensure compatibility across all platforms while maximizing citation likelihood for each system."
ai-overview-optimization,"AI Overview Signal Engineering","We engineer AI Overview signals that improve how Google AI Overviews includes your content. This includes AI Overview-specific structured data, entity clarity optimization, and AI Overview citation signals. Google AI Overviews uses specific signals to determine content inclusion, so we optimize all AI Overview-critical elements to maximize inclusion likelihood and citation accuracy."
ai-overview-optimization,"AI Overview Structured Data","We implement AI Overview-specific structured data including comprehensive entity definitions, explicit factual statements, and AI Overview citation anchors. This includes entity clarity optimization (explicit entity definitions, clear entity relationships, unambiguous entity references), AI Overview citation signals (citation-ready content structure, explicit source attribution, verifiable claims), and AI Overview structured data (comprehensive JSON-LD, explicit entity definitions, AI Overview-specific markup)."
ai-overview-optimization,"AI Overview Content Optimization","We optimize content for AI Overview inclusion by implementing explicit factual statements, verifiable claims, and AI Overview citation anchors. This includes AI Overview content structure (atomic content blocks, explicit entity definitions, citation-ready factual statements), AI Overview citation signals (explicit source attribution, verifiable URLs, current information), and AI Overview entity clarity (explicit entity definitions, clear entity relationships, unambiguous entity references)."
ai-overview-optimization,"AI Overview Entity Clarity","We optimize entity clarity for AI Overview inclusion by implementing explicit entity definitions, clear entity relationships, and unambiguous entity references. This includes entity definition optimization (explicit entity definitions, clear entity relationships, unambiguous entity references), entity relationship clarity (explicit entity relationships, clear entity hierarchies, unambiguous entity connections), and entity disambiguation (explicit entity disambiguation, clear entity distinctions, unambiguous entity identification)."
ai-overviews-optimization,"AI Overviews Signal Engineering","We engineer AI Overviews signals that improve how Google AI Overviews includes your content. This includes AI Overviews-specific structured data, entity clarity optimization, and AI Overviews citation signals. Google AI Overviews uses specific signals to determine content inclusion, so we optimize all AI Overviews-critical elements to maximize inclusion likelihood and citation accuracy."
ai-overviews-optimization,"AI Overviews Structured Data Implementation","We implement AI Overviews-specific structured data including comprehensive entity definitions, explicit factual statements, and AI Overviews citation anchors. This includes entity clarity optimization (explicit entity definitions, clear entity relationships, unambiguous entity references), AI Overviews citation signals (citation-ready content structure, explicit source attribution, verifiable claims), and AI Overviews structured data (comprehensive JSON-LD, explicit entity definitions, AI Overviews-specific markup)."
ai-overviews-optimization,"AI Overviews Content Architecture","We structure content for AI Overviews inclusion by implementing atomic content blocks, explicit entity definitions, and citation-ready factual statements. AI Overviews requires clear, unambiguous content structure to generate accurate overviews, so we optimize content architecture for maximum AI Overviews comprehension and inclusion likelihood."
ai-overviews-optimization,"AI Overviews Entity & Citation Optimization","We optimize entity clarity and citation signals for AI Overviews inclusion by implementing explicit entity definitions, clear entity relationships, and AI Overviews citation anchors. This includes entity definition optimization (explicit entity definitions, clear entity relationships, unambiguous entity references), citation signal enhancement (explicit source attribution, verifiable URLs, current information), and AI Overviews-specific optimization (AI Overviews-structured data, AI Overviews citation signals, AI Overviews entity clarity)."
ai-search-optimization,"AI Search Signal Engineering","We engineer AI search signals that improve how AI search systems find and rank your content. This includes AI search-specific structured data, entity clarity optimization, and AI search ranking signals. AI search systems use specific signals to determine content relevance and ranking, so we optimize all AI search-critical elements to maximize visibility and ranking position."
ai-search-optimization,"AI Search Structured Data & Entity Optimization","We implement AI search-specific structured data including comprehensive entity definitions, explicit factual statements, and AI search ranking signals. This includes entity clarity optimization (explicit entity definitions, clear entity relationships, unambiguous entity references), AI search ranking signals (relevance markers, authority indicators, trust signals), and AI search structured data (comprehensive JSON-LD, explicit entity definitions, AI search-specific markup)."
ai-search-optimization,"AI Search Content Architecture","We structure content for AI search systems by implementing atomic content blocks, explicit entity definitions, and AI search-optimized content patterns. AI search systems require clear, unambiguous content structure to match queries to content, so we optimize content architecture for maximum AI search comprehension and ranking likelihood."
ai-search-optimization,"Multi-Platform AI Search Optimization","We optimize content for multiple AI search platforms (ChatGPT, Claude, Perplexity, Google AI Overviews, Microsoft Copilot) by implementing platform-agnostic structured data and content patterns that work across all AI search engines. Each system has unique requirements, so we ensure compatibility across all platforms while maximizing visibility and ranking position for each system."
analytics,"AI Visibility Analytics & Measurement","We implement comprehensive AI visibility analytics and measurement systems to track how AI systems find, understand, and cite your content. This includes AI citation tracking (brand mentions, URL accuracy, fact correctness), AI visibility monitoring (AI engine visibility, citation frequency, citation accuracy), and AI performance analytics (citation metrics, visibility trends, performance indicators)."
analytics,"AI Engine Performance Tracking","We track AI engine performance across multiple platforms including ChatGPT, Claude, Perplexity, and Google AI Overviews. This includes citation accuracy tracking (brand mentions, URL accuracy, fact correctness), visibility monitoring (AI engine visibility, citation frequency, citation accuracy), and performance analytics (citation metrics, visibility trends, performance indicators)."
analytics,"AI Citation Analytics & Reporting","We provide comprehensive AI citation analytics and reporting including citation frequency, citation accuracy, and citation trends. This includes citation tracking (brand mentions, URL accuracy, fact correctness), citation analytics (citation frequency, citation accuracy, citation trends), and citation reporting (detailed citation reports, citation trends, citation insights)."
analytics,"AI Visibility Measurement & Optimization","We measure and optimize AI visibility across multiple platforms and provide detailed analytics and insights. This includes visibility measurement (AI engine visibility, citation frequency, citation accuracy), visibility analytics (visibility trends, performance indicators, optimization opportunities), and visibility optimization (optimization recommendations, performance improvements, visibility enhancements)."
authority-optimization-ai,"Authority Signal Engineering","We engineer authority signals that improve how AI systems evaluate and trust your content. This includes authority indicators, credibility markers, and trust signals. AI systems use authority signals to determine content trustworthiness, so we optimize all authority-critical elements to maximize AI system confidence and citation likelihood."
authority-optimization-ai,"Authority Indicator Implementation","We implement authority indicators including author credentials, organization authority, and content authority signals. This includes author authority (author credentials, author expertise, author credibility), organization authority (organization credentials, organization expertise, organization credibility), and content authority (content credibility, content expertise, content trustworthiness)."
authority-optimization-ai,"Credibility & Trust Signal Optimization","We optimize credibility and trust signals by implementing explicit authority markers, credibility indicators, and trust signals. This includes authority signal enhancement (author credentials, organization authority, content authority), credibility optimization (credibility indicators, trust signals, authority markers), and trust signal implementation (trust indicators, credibility markers, authority signals)."
authority-optimization-ai,"Multi-Platform Authority Optimization","We optimize authority signals across multiple AI platforms (ChatGPT, Claude, Perplexity, Google AI Overviews) by implementing platform-agnostic authority indicators and credibility markers that work across all AI engines. Each system has unique authority requirements, so we ensure compatibility across all platforms while maximizing authority recognition and citation likelihood for each system."
b2b-seo-ai,"B2B Entity & Service Optimization","We optimize B2B entities and services for AI systems by implementing comprehensive B2B-specific structured data, explicit service definitions, and B2B entity clarity. This includes B2B entity optimization (explicit B2B entity definitions, clear B2B service relationships, unambiguous B2B entity references), B2B service clarity (explicit B2B service definitions, clear B2B service relationships, unambiguous B2B service references), and B2B structured data (comprehensive B2B JSON-LD, explicit B2B entity definitions, B2B-specific markup)."
b2b-seo-ai,"B2B Content Architecture & Citation Optimization","We structure B2B content for AI systems by implementing atomic B2B content blocks, explicit B2B entity definitions, and B2B citation-ready factual statements. B2B AI systems require clear, unambiguous B2B content structure to generate accurate responses, so we optimize B2B content architecture for maximum B2B AI comprehension and citation likelihood."
b2b-seo-ai,"B2B Service Schema & Entity Mapping","We implement comprehensive B2B service schema and entity mapping including B2B Service schema, B2B Organization schema, and B2B entity relationships. This includes B2B service schema (comprehensive B2B Service JSON-LD, explicit B2B service definitions, B2B service relationships), B2B entity mapping (B2B entity relationships, B2B entity hierarchies, B2B entity disambiguation), and B2B structured data (comprehensive B2B JSON-LD, explicit B2B entity definitions, B2B-specific markup)."
b2b-seo-ai,"B2B AI Platform Optimization","We optimize B2B content for multiple AI platforms (ChatGPT, Claude, Perplexity, Google AI Overviews) by implementing platform-agnostic B2B structured data and content patterns that work across all B2B AI engines. Each system has unique B2B requirements, so we ensure compatibility across all platforms while maximizing B2B citation likelihood for each system."
bard-optimization,"Bard Signal Engineering","We engineer Bard signals that improve how Google Bard includes and cites your content. This includes Bard-specific structured data, entity clarity optimization, and Bard citation signals. Google Bard uses specific signals to determine content inclusion, so we optimize all Bard-critical elements to maximize inclusion likelihood and citation accuracy."
bard-optimization,"Bard Structured Data Implementation","We implement Bard-specific structured data including comprehensive entity definitions, explicit factual statements, and Bard citation anchors. This includes entity clarity optimization (explicit entity definitions, clear entity relationships, unambiguous entity references), Bard citation signals (citation-ready content structure, explicit source attribution, verifiable claims), and Bard structured data (comprehensive JSON-LD, explicit entity definitions, Bard-specific markup)."
bard-optimization,"Bard Content Architecture","We structure content for Bard inclusion by implementing atomic content blocks, explicit entity definitions, and Bard citation-ready factual statements. Bard requires clear, unambiguous content structure to generate accurate responses, so we optimize content architecture for maximum Bard comprehension and citation likelihood."
bard-optimization,"Bard Entity & Citation Optimization","We optimize entity clarity and citation signals for Bard inclusion by implementing explicit entity definitions, clear entity relationships, and Bard citation anchors. This includes entity definition optimization (explicit entity definitions, clear entity relationships, unambiguous entity references), citation signal enhancement (explicit source attribution, verifiable URLs, current information), and Bard-specific optimization (Bard-structured data, Bard citation signals, Bard entity clarity)."
chatgpt-optimization,"ChatGPT Signal Engineering","We engineer ChatGPT signals that improve how ChatGPT includes and cites your content. This includes ChatGPT-specific structured data, entity clarity optimization, and ChatGPT citation signals. ChatGPT uses specific signals to determine content inclusion, so we optimize all ChatGPT-critical elements to maximize inclusion likelihood and citation accuracy."
chatgpt-optimization,"ChatGPT Structured Data Implementation","We implement ChatGPT-specific structured data including comprehensive entity definitions, explicit factual statements, and ChatGPT citation anchors. This includes entity clarity optimization (explicit entity definitions, clear entity relationships, unambiguous entity references), ChatGPT citation signals (citation-ready content structure, explicit source attribution, verifiable claims), and ChatGPT structured data (comprehensive JSON-LD, explicit entity definitions, ChatGPT-specific markup)."
chatgpt-optimization,"ChatGPT Content Architecture","We structure content for ChatGPT inclusion by implementing atomic content blocks, explicit entity definitions, and ChatGPT citation-ready factual statements. ChatGPT requires clear, unambiguous content structure to generate accurate responses, so we optimize content architecture for maximum ChatGPT comprehension and citation likelihood."
chatgpt-optimization,"ChatGPT Entity & Citation Optimization","We optimize entity clarity and citation signals for ChatGPT inclusion by implementing explicit entity definitions, clear entity relationships, and ChatGPT citation anchors. This includes entity definition optimization (explicit entity definitions, clear entity relationships, unambiguous entity references), citation signal enhancement (explicit source attribution, verifiable URLs, current information), and ChatGPT-specific optimization (ChatGPT-structured data, ChatGPT citation signals, ChatGPT entity clarity)."
claude-optimization,"Claude Signal Engineering","We engineer Claude signals that improve how Claude includes and cites your content. This includes Claude-specific structured data, entity clarity optimization, and Claude citation signals. Claude uses specific signals to determine content inclusion, so we optimize all Claude-critical elements to maximize inclusion likelihood and citation accuracy."
claude-optimization,"Claude Structured Data Implementation","We implement Claude-specific structured data including comprehensive entity definitions, explicit factual statements, and Claude citation anchors. This includes entity clarity optimization (explicit entity definitions, clear entity relationships, unambiguous entity references), Claude citation signals (citation-ready content structure, explicit source attribution, verifiable claims), and Claude structured data (comprehensive JSON-LD, explicit entity definitions, Claude-specific markup)."
claude-optimization,"Claude Content Architecture","We structure content for Claude inclusion by implementing atomic content blocks, explicit entity definitions, and Claude citation-ready factual statements. Claude requires clear, unambiguous content structure to generate accurate responses, so we optimize content architecture for maximum Claude comprehension and citation likelihood."
claude-optimization,"Claude Entity & Citation Optimization","We optimize entity clarity and citation signals for Claude inclusion by implementing explicit entity definitions, clear entity relationships, and Claude citation anchors. This includes entity definition optimization (explicit entity definitions, clear entity relationships, unambiguous entity references), citation signal enhancement (explicit source attribution, verifiable URLs, current information), and Claude-specific optimization (Claude-structured data, Claude citation signals, Claude entity clarity)."
competitor-analysis-ai,"AI Competitor Signal Analysis","We analyze competitor AI signals to identify optimization opportunities and competitive advantages. This includes competitor AI visibility analysis (competitor AI citations, competitor AI visibility, competitor AI ranking), competitor signal analysis (competitor structured data, competitor entity clarity, competitor citation signals), and competitive intelligence (competitor insights, optimization opportunities, competitive advantages)."
competitor-analysis-ai,"Competitor AI Visibility Tracking","We track competitor AI visibility across multiple platforms including ChatGPT, Claude, Perplexity, and Google AI Overviews. This includes competitor citation tracking (competitor brand mentions, competitor URL accuracy, competitor fact correctness), competitor visibility monitoring (competitor AI engine visibility, competitor citation frequency, competitor citation accuracy), and competitor performance analytics (competitor citation metrics, competitor visibility trends, competitor performance indicators)."
competitor-analysis-ai,"Competitive Signal Optimization","We optimize your AI signals based on competitor analysis to identify optimization opportunities and competitive advantages. This includes competitive signal analysis (competitor structured data, competitor entity clarity, competitor citation signals), optimization opportunity identification (optimization gaps, competitive advantages, improvement opportunities), and competitive intelligence (competitor insights, optimization recommendations, competitive strategies)."
competitor-analysis-ai,"AI Competitive Intelligence & Strategy","We provide comprehensive AI competitive intelligence and strategy including competitor analysis, optimization opportunities, and competitive advantages. This includes competitor analysis (competitor AI visibility, competitor AI citations, competitor AI ranking), competitive intelligence (competitor insights, optimization opportunities, competitive advantages), and competitive strategy (optimization recommendations, competitive strategies, performance improvements)."
completeness-optimization-ai,"Completeness Signal Engineering","We engineer completeness signals that improve how AI systems evaluate and trust your content. This includes completeness indicators, comprehensive content markers, and completeness validation patterns. AI systems use completeness signals to determine content trustworthiness, so we optimize all completeness-critical elements to maximize AI system confidence and citation likelihood."
