service,block_title,body
structured-data-ai,"Multi-Platform AI Structured Data Optimization","We optimize structured data for multiple AI platforms (ChatGPT, Claude, Perplexity, Google AI Overviews) by implementing platform-agnostic structured data markup and patterns that work across all AI structured data engines. Each system has unique structured data requirements, so we ensure compatibility across all platforms while maximizing structured data comprehension and processing accuracy for each system."
technical-audit-ai,"AI Technical Audit & Assessment","We conduct comprehensive AI technical audits and assessments to identify AI optimization opportunities and technical issues. This includes AI technical audit (comprehensive AI technical assessment, AI optimization opportunities, AI technical issues), AI technical analysis (AI structured data analysis, AI entity clarity analysis, AI citation signal analysis), and AI technical recommendations (AI optimization recommendations, AI technical improvements, AI performance enhancements)."
technical-audit-ai,"AI Technical Signal Analysis","We analyze AI technical signals to identify optimization opportunities and technical issues. This includes AI technical signal analysis (AI structured data signals, AI entity clarity signals, AI citation signals), AI technical assessment (comprehensive AI technical assessment, AI optimization opportunities, AI technical issues), and AI technical recommendations (AI optimization recommendations, AI technical improvements, AI performance enhancements)."
technical-audit-ai,"AI Technical Optimization Recommendations","We provide comprehensive AI technical optimization recommendations including optimization opportunities, technical improvements, and performance enhancements. This includes AI optimization recommendations (AI structured data optimization, AI entity clarity optimization, AI citation signal optimization), AI technical improvements (AI technical fixes, AI technical enhancements, AI technical optimizations), and AI performance enhancements (AI performance improvements, AI visibility enhancements, AI citation improvements)."
technical-audit-ai,"Multi-Platform AI Technical Audit","We conduct AI technical audits across multiple platforms (ChatGPT, Claude, Perplexity, Google AI Overviews) to identify platform-specific optimization opportunities and technical issues. Each system has unique technical requirements, so we ensure comprehensive coverage across all platforms while identifying platform-specific optimization opportunities and technical issues for each system."
topic-modeling-ai,"Topic Modeling Signal Engineering","We engineer topic modeling signals that improve how AI systems understand and categorize your content topics. This includes topic modeling optimization, explicit topic definitions, and topic modeling AI signals. Topic modeling AI systems use specific signals to determine topic understanding, so we optimize all topic modeling-critical elements to maximize topic comprehension and categorization accuracy."
topic-modeling-ai,"Topic Modeling Content Architecture","We structure content for topic modeling AI systems by implementing topic-optimized content blocks, explicit topic entity definitions, and topic-ready content patterns. Topic modeling AI systems require clear, unambiguous topic-optimized content structure to model topics accurately, so we optimize topic content architecture for maximum topic modeling AI comprehension and categorization accuracy."
topic-modeling-ai,"Topic Modeling Structured Data Implementation","We implement topic modeling-specific structured data including comprehensive topic entity definitions, explicit topic relationships, and topic modeling AI signals. This includes topic modeling structured data (comprehensive topic modeling JSON-LD, explicit topic entity definitions, topic modeling-specific markup), topic entity optimization (explicit topic entity definitions, clear topic entity relationships, unambiguous topic entity references), and topic modeling AI signals (topic modeling-specific structured data, topic entity relationships, topic entity clarity)."
topic-modeling-ai,"Multi-Platform Topic Modeling AI Optimization","We optimize content for topic modeling AI across multiple platforms (ChatGPT, Claude, Perplexity, Google AI Overviews) by implementing platform-agnostic topic modeling structured data and content patterns that work across all topic modeling AI engines. Each system has unique topic modeling requirements, so we ensure compatibility across all platforms while maximizing topic comprehension and categorization accuracy for each system."
transparency-optimization-ai,"Transparency Signal Engineering","We engineer transparency signals that improve how AI systems evaluate and trust your content transparency. This includes transparency indicators, explicit transparency markers, and transparency validation patterns. AI systems use transparency signals to determine content trustworthiness, so we optimize all transparency-critical elements to maximize AI system confidence and citation likelihood."
transparency-optimization-ai,"Transparency Optimization & Validation","We optimize transparency by implementing explicit transparency markers, transparency indicators, and transparency validation. This includes transparency signal enhancement (transparency markers, transparency indicators, transparency validation), transparency optimization (explicit transparency, clear transparency, transparent processes), and transparency validation (transparency checks, transparency verification, transparency reporting)."
transparency-optimization-ai,"Transparency Validation & Reporting","We implement comprehensive transparency validation and reporting systems including transparency checks, transparency verification, and transparency reporting. This includes transparency validation (transparency checks, transparency verification, transparency reporting), transparency analytics (transparency metrics, transparency trends, transparency insights), and transparency optimization (transparency improvements, transparency enhancements, transparency recommendations)."
transparency-optimization-ai,"AI System Transparency Alignment","We align content with AI system transparency requirements including explicit transparency markers, transparency indicators, and transparency validation. AI systems prioritize certain transparency factors—transparency clarity (explicit transparency, clear transparency, transparent processes), transparency indicators (transparency markers, transparency indicators, transparency validation), and transparency trust (transparency verification, transparency reporting, transparency confidence). We ensure your content maximizes all transparency-critical factors to improve AI system confidence and citation likelihood."
trust-optimization-ai,"Trust Signal Engineering","We engineer trust signals that improve how AI systems evaluate and trust your content. This includes trust indicators, credibility markers, and trust validation patterns. AI systems use trust signals to determine content trustworthiness, so we optimize all trust-critical elements to maximize AI system confidence and citation likelihood."
trust-optimization-ai,"Trust Optimization & Validation","We optimize trust by implementing explicit trust markers, trust indicators, and trust validation. This includes trust signal enhancement (trust markers, trust indicators, trust validation), trust optimization (explicit trust, clear trust, trustworthy processes), and trust validation (trust checks, trust verification, trust reporting)."
trust-optimization-ai,"Trust Validation & Reporting","We implement comprehensive trust validation and reporting systems including trust checks, trust verification, and trust reporting. This includes trust validation (trust checks, trust verification, trust reporting), trust analytics (trust metrics, trust trends, trust insights), and trust optimization (trust improvements, trust enhancements, trust recommendations)."
trust-optimization-ai,"AI System Trust Alignment","We align content with AI system trust requirements including explicit trust markers, trust indicators, and trust validation. AI systems prioritize certain trust factors—trust clarity (explicit trust, clear trust, trustworthy processes), trust indicators (trust markers, trust indicators, trust validation), and trust confidence (trust verification, trust reporting, trust confidence). We ensure your content maximizes all trust-critical factors to improve AI system confidence and citation likelihood."
verification-optimization-ai,"Verification Signal Engineering","We engineer verification signals that improve how AI systems verify and trust your content. This includes verification indicators, explicit verification markers, and verification validation patterns. AI systems use verification signals to determine content trustworthiness, so we optimize all verification-critical elements to maximize AI system confidence and citation likelihood."
verification-optimization-ai,"Verification Optimization & Validation","We optimize verification by implementing explicit verification markers, verification indicators, and verification validation. This includes verification signal enhancement (verification markers, verification indicators, verification validation), verification optimization (explicit verification, clear verification, verifiable processes), and verification validation (verification checks, verification verification, verification reporting)."
verification-optimization-ai,"Verification Validation & Reporting","We implement comprehensive verification validation and reporting systems including verification checks, verification verification, and verification reporting. This includes verification validation (verification checks, verification verification, verification reporting), verification analytics (verification metrics, verification trends, verification insights), and verification optimization (verification improvements, verification enhancements, verification recommendations)."
verification-optimization-ai,"AI System Verification Alignment","We align content with AI system verification requirements including explicit verification markers, verification indicators, and verification validation. AI systems prioritize certain verification factors—verification clarity (explicit verification, clear verification, verifiable processes), verification indicators (verification markers, verification indicators, verification validation), and verification confidence (verification verification, verification reporting, verification confidence). We ensure your content maximizes all verification-critical factors to improve AI system confidence and citation likelihood."
voice-search-optimization,"Voice Search Signal Engineering","We engineer voice search signals that improve how AI voice assistants find and cite your content. This includes voice search optimization, explicit voice search entity definitions, and voice search AI signals. Voice search AI systems use specific signals to determine voice search understanding, so we optimize all voice search-critical elements to maximize voice search comprehension and citation accuracy."
voice-search-optimization,"Voice Search Content Architecture","We structure content for voice search AI systems by implementing voice search-optimized content blocks, explicit voice search entity definitions, and voice search-ready content patterns. Voice search AI systems require clear, unambiguous voice search-optimized content structure to process voice queries accurately, so we optimize voice search content architecture for maximum voice search AI comprehension and citation accuracy."
voice-search-optimization,"Voice Search Structured Data Implementation","We implement voice search-specific structured data including comprehensive voice search entity definitions, explicit voice search relationships, and voice search AI signals. This includes voice search structured data (comprehensive voice search JSON-LD, explicit voice search entity definitions, voice search-specific markup), voice search entity optimization (explicit voice search entity definitions, clear voice search entity relationships, unambiguous voice search entity references), and voice search AI signals (voice search-specific structured data, voice search entity relationships, voice search entity clarity)."
voice-search-optimization,"Multi-Platform Voice Search AI Optimization","We optimize content for voice search AI across multiple platforms (Google Assistant, Amazon Alexa, Apple Siri, Microsoft Cortana) by implementing platform-agnostic voice search structured data and content patterns that work across all voice search AI engines. Each system has unique voice search requirements, so we ensure compatibility across all platforms while maximizing voice search comprehension and citation accuracy for each system."
