service,block_title,body
link-building-ai,"AI Link Signal Engineering","We engineer AI link signals that improve how AI systems understand and value your link profile. This includes AI link quality indicators, link authority markers, and AI link trust signals. AI systems use link signals to determine content authority and trustworthiness, so we optimize all AI link-critical elements to maximize link authority and citation likelihood."
link-building-ai,"AI Link Quality & Authority Optimization","We optimize AI link quality and authority by implementing high-quality link acquisition, link authority markers, and AI link trust signals. This includes link quality optimization (high-quality link acquisition, relevant link sources, authoritative link targets), link authority enhancement (link authority markers, link trust signals, link credibility indicators), and AI link signals (AI link quality indicators, AI link authority markers, AI link trust signals)."
link-building-ai,"AI Link Profile & Trust Signals","We implement comprehensive AI link profile and trust signal optimization including link profile analysis, link trust signals, and AI link authority markers. This includes link profile optimization (comprehensive link profile, relevant link sources, authoritative link targets), link trust signals (link trust indicators, link credibility markers, link authority signals), and AI link signals (AI link quality indicators, AI link authority markers, AI link trust signals)."
link-building-ai,"Multi-Platform AI Link Optimization","We optimize links for AI systems across multiple platforms (ChatGPT, Claude, Perplexity, Google AI Overviews) by implementing platform-agnostic link quality indicators and authority markers that work across all AI engines. Each system has unique link requirements, so we ensure compatibility across all platforms while maximizing link authority and citation likelihood for each system."
llm-content-strategy,"LLM Content Strategy & Architecture","We develop comprehensive LLM content strategies and architectures that optimize content for LLM systems. This includes LLM content planning (LLM content strategy, LLM content architecture, LLM content optimization), LLM content structure (atomic LLM content blocks, explicit LLM entity definitions, LLM citation-ready factual statements), and LLM content optimization (LLM content formatting, LLM citation signals, LLM entity clarity)."
llm-content-strategy,"LLM Content Optimization & Citation Signals","We optimize LLM content for citation by implementing explicit factual statements, verifiable claims, and LLM citation anchors. This includes LLM content optimization (explicit factual statements, verifiable claims, LLM citation anchors), LLM citation signals (explicit source attribution, verifiable URLs, current information), and LLM content formatting (atomic paragraphs, explicit definitions, clear hierarchies optimized for LLM parsing and citation)."
llm-content-strategy,"LLM Content Entity & Structure Optimization","We optimize LLM content entities and structure by implementing explicit LLM entity definitions, clear LLM entity relationships, and LLM content structure optimization. This includes LLM entity optimization (explicit LLM entity definitions, clear LLM entity relationships, unambiguous LLM entity references), LLM content structure (atomic LLM content blocks, explicit LLM entity definitions, LLM citation-ready factual statements), and LLM content formatting (LLM-optimized content formatting, LLM citation signals, LLM entity clarity)."
llm-content-strategy,"Multi-LLM Platform Content Strategy","We develop content strategies for multiple LLM platforms (ChatGPT, Claude, Perplexity, Google AI Overviews) by implementing platform-agnostic LLM content patterns and structured data that work across all LLM engines. Each system has unique LLM content requirements, so we ensure compatibility across all platforms while maximizing citation likelihood for each system."
local-seo-ai,"Local AI Signal Engineering","We engineer local AI signals that improve how AI systems understand and cite your local business. This includes local entity optimization, location-anchored structured data, and local AI citation signals. Local AI systems use specific signals to determine local business understanding and citation likelihood, so we optimize all local AI-critical elements to maximize local entity comprehension and citation accuracy."
local-seo-ai,"Local Entity & Location Optimization","We optimize local entities and locations by implementing explicit local entity definitions, clear location signals, and local AI entity clarity. This includes local entity optimization (explicit local entity definitions, clear local entity relationships, unambiguous local entity references), location signal enhancement (location-anchored structured data, geo coordinates, location-specific entity references), and local AI entity clarity (local AI-specific structured data, local AI entity relationships, local AI entity clarity)."
local-seo-ai,"Local Business Schema & Entity Mapping","We implement comprehensive local business schema and entity mapping including LocalBusiness schema, Place schema, and local entity relationships. This includes local business schema (comprehensive LocalBusiness JSON-LD, explicit local business definitions, local business relationships), local entity mapping (local entity relationships, local entity hierarchies, local entity disambiguation), and local structured data (comprehensive local JSON-LD, explicit local entity definitions, local-specific markup)."
local-seo-ai,"Multi-Platform Local AI Optimization","We optimize local content for multiple AI platforms (ChatGPT, Claude, Perplexity, Google AI Overviews) by implementing platform-agnostic local structured data and content patterns that work across all local AI engines. Each system has unique local requirements, so we ensure compatibility across all platforms while maximizing local citation likelihood for each system."
metadata-optimization-ai,"Metadata Signal Engineering","We engineer metadata signals that improve how AI systems understand and rank your content. This includes metadata optimization, explicit metadata definitions, and metadata clarity enhancement. AI systems use metadata signals to determine content understanding and ranking, so we optimize all metadata-critical elements to maximize metadata comprehension and ranking position."
metadata-optimization-ai,"Metadata Optimization & Clarity Enhancement","We optimize metadata by implementing explicit metadata definitions, clear metadata relationships, and metadata clarity enhancement. This includes metadata definition optimization (explicit metadata definitions, clear metadata relationships, unambiguous metadata references), metadata clarity enhancement (metadata clarity markers, metadata relationship clarity, metadata disambiguation), and metadata structured data (comprehensive metadata JSON-LD, explicit metadata definitions, metadata-specific markup)."
metadata-optimization-ai,"AI Metadata Structured Data Implementation","We implement AI metadata-specific structured data including comprehensive metadata definitions, explicit metadata relationships, and AI metadata signals. This includes AI metadata structured data (comprehensive AI metadata JSON-LD, explicit AI metadata definitions, AI metadata-specific markup), AI metadata optimization (explicit AI metadata definitions, clear AI metadata relationships, unambiguous AI metadata references), and AI metadata signals (AI metadata-specific structured data, AI metadata relationships, AI metadata clarity)."
metadata-optimization-ai,"Multi-Platform AI Metadata Optimization","We optimize metadata for multiple AI platforms (ChatGPT, Claude, Perplexity, Google AI Overviews) by implementing platform-agnostic AI metadata structured data and definitions that work across all AI engines. Each system has unique metadata requirements, so we ensure compatibility across all platforms while maximizing metadata comprehension and ranking position for each system."
multimodal-seo-ai,"Multimodal Signal Engineering","We engineer multimodal signals that improve how AI systems understand and process your multimodal content. This includes multimodal content optimization, explicit multimodal entity definitions, and multimodal AI signals. Multimodal AI systems use specific signals to determine multimodal content understanding, so we optimize all multimodal-critical elements to maximize multimodal comprehension and processing accuracy."
multimodal-seo-ai,"Multimodal Content Architecture & Optimization","We structure multimodal content for AI systems by implementing atomic multimodal content blocks, explicit multimodal entity definitions, and multimodal citation-ready content patterns. Multimodal AI systems require clear, unambiguous multimodal content structure to process multimodal content accurately, so we optimize multimodal content architecture for maximum multimodal AI comprehension and processing accuracy."
multimodal-seo-ai,"Multimodal Structured Data Implementation","We implement multimodal-specific structured data including comprehensive multimodal entity definitions, explicit multimodal relationships, and multimodal AI signals. This includes multimodal structured data (comprehensive multimodal JSON-LD, explicit multimodal entity definitions, multimodal-specific markup), multimodal entity optimization (explicit multimodal entity definitions, clear multimodal entity relationships, unambiguous multimodal entity references), and multimodal AI signals (multimodal-specific structured data, multimodal entity relationships, multimodal entity clarity)."
multimodal-seo-ai,"Multi-Platform Multimodal AI Optimization","We optimize multimodal content for multiple AI platforms (ChatGPT, Claude, Perplexity, Google AI Overviews) by implementing platform-agnostic multimodal structured data and content patterns that work across all multimodal AI engines. Each system has unique multimodal requirements, so we ensure compatibility across all platforms while maximizing multimodal comprehension and processing accuracy for each system."
perplexity-optimization,"Perplexity Signal Engineering","We engineer Perplexity signals that improve how Perplexity includes and cites your content. This includes Perplexity-specific structured data, entity clarity optimization, and Perplexity citation signals. Perplexity uses specific signals to determine content inclusion, so we optimize all Perplexity-critical elements to maximize inclusion likelihood and citation accuracy."
perplexity-optimization,"Perplexity Structured Data Implementation","We implement Perplexity-specific structured data including comprehensive entity definitions, explicit factual statements, and Perplexity citation anchors. This includes entity clarity optimization (explicit entity definitions, clear entity relationships, unambiguous entity references), Perplexity citation signals (citation-ready content structure, explicit source attribution, verifiable claims), and Perplexity structured data (comprehensive JSON-LD, explicit entity definitions, Perplexity-specific markup)."
perplexity-optimization,"Perplexity Content Architecture","We structure content for Perplexity inclusion by implementing atomic content blocks, explicit entity definitions, and Perplexity citation-ready factual statements. Perplexity requires clear, unambiguous content structure to generate accurate responses, so we optimize content architecture for maximum Perplexity comprehension and citation likelihood."
perplexity-optimization,"Perplexity Entity & Citation Optimization","We optimize entity clarity and citation signals for Perplexity inclusion by implementing explicit entity definitions, clear entity relationships, and Perplexity citation anchors. This includes entity definition optimization (explicit entity definitions, clear entity relationships, unambiguous entity references), citation signal enhancement (explicit source attribution, verifiable URLs, current information), and Perplexity-specific optimization (Perplexity-structured data, Perplexity citation signals, Perplexity entity clarity)."
personalization-ai,"Personalization Signal Engineering","We engineer personalization signals that improve how AI systems personalize content for individual users. This includes personalization indicators, user-specific content optimization, and personalization AI signals. Personalization AI systems use specific signals to determine content personalization, so we optimize all personalization-critical elements to maximize personalization accuracy and user relevance."
personalization-ai,"Personalization Content Architecture","We structure content for personalization AI systems by implementing personalization-optimized content blocks, explicit personalization entity definitions, and personalization-ready content patterns. Personalization AI systems require clear, unambiguous personalization-optimized content structure to personalize content accurately, so we optimize personalization content architecture for maximum personalization AI comprehension and personalization accuracy."
personalization-ai,"Personalization Structured Data Implementation","We implement personalization-specific structured data including comprehensive personalization entity definitions, explicit personalization relationships, and personalization AI signals. This includes personalization structured data (comprehensive personalization JSON-LD, explicit personalization entity definitions, personalization-specific markup), personalization entity optimization (explicit personalization entity definitions, clear personalization entity relationships, unambiguous personalization entity references), and personalization AI signals (personalization-specific structured data, personalization entity relationships, personalization entity clarity)."
personalization-ai,"Multi-Platform Personalization AI Optimization","We optimize content for personalization AI across multiple platforms (ChatGPT, Claude, Perplexity, Google AI Overviews) by implementing platform-agnostic personalization structured data and content patterns that work across all personalization AI engines. Each system has unique personalization requirements, so we ensure compatibility across all platforms while maximizing personalization accuracy and user relevance for each system."
ranking-optimization-ai,"Ranking Signal Engineering","We engineer ranking signals that improve how AI systems rank your content. This includes ranking factor optimization, explicit ranking signals, and ranking AI signals. AI ranking systems use specific signals to determine content ranking, so we optimize all ranking-critical elements to maximize ranking position and visibility."
ranking-optimization-ai,"Ranking Factor Optimization & Alignment","We optimize ranking factors by implementing explicit ranking signals, ranking factor alignment, and ranking AI signals. This includes ranking factor optimization (explicit ranking signals, ranking factor alignment, ranking AI signals), ranking signal enhancement (ranking markers, ranking indicators, ranking optimization), and ranking structured data (comprehensive ranking JSON-LD, explicit ranking entity definitions, ranking-specific markup)."
ranking-optimization-ai,"AI Ranking Content Architecture","We structure content for AI ranking systems by implementing ranking-optimized content blocks, explicit ranking entity definitions, and ranking-ready content patterns. AI ranking systems require clear, unambiguous ranking-optimized content structure to rank content accurately, so we optimize ranking content architecture for maximum AI ranking comprehension and ranking position."
ranking-optimization-ai,"Multi-Platform AI Ranking Optimization","We optimize content for AI ranking across multiple platforms (ChatGPT, Claude, Perplexity, Google AI Overviews) by implementing platform-agnostic ranking structured data and content patterns that work across all AI ranking engines. Each system has unique ranking requirements, so we ensure compatibility across all platforms while maximizing ranking position and visibility for each system."
recommendation-ai,"Recommendation Signal Engineering","We engineer recommendation signals that improve how AI systems recommend your content. This includes recommendation indicators, recommendation-focused content optimization, and recommendation AI signals. Recommendation AI systems use specific signals to determine content recommendation, so we optimize all recommendation-critical elements to maximize recommendation likelihood and user engagement."
recommendation-ai,"Recommendation Content Architecture","We structure content for recommendation AI systems by implementing recommendation-optimized content blocks, explicit recommendation entity definitions, and recommendation-ready content patterns. Recommendation AI systems require clear, unambiguous recommendation-optimized content structure to recommend content accurately, so we optimize recommendation content architecture for maximum recommendation AI comprehension and recommendation likelihood."
recommendation-ai,"Recommendation Structured Data Implementation","We implement recommendation-specific structured data including comprehensive recommendation entity definitions, explicit recommendation relationships, and recommendation AI signals. This includes recommendation structured data (comprehensive recommendation JSON-LD, explicit recommendation entity definitions, recommendation-specific markup), recommendation entity optimization (explicit recommendation entity definitions, clear recommendation entity relationships, unambiguous recommendation entity references), and recommendation AI signals (recommendation-specific structured data, recommendation entity relationships, recommendation entity clarity)."
recommendation-ai,"Multi-Platform Recommendation AI Optimization","We optimize content for recommendation AI across multiple platforms (ChatGPT, Claude, Perplexity, Google AI Overviews) by implementing platform-agnostic recommendation structured data and content patterns that work across all recommendation AI engines. Each system has unique recommendation requirements, so we ensure compatibility across all platforms while maximizing recommendation likelihood and user engagement for each system."
relevance-optimization-ai,"Relevance Signal Engineering","We engineer relevance signals that improve how AI systems determine content relevance. This includes relevance indicators, relevance-focused content optimization, and relevance AI signals. AI relevance systems use specific signals to determine content relevance, so we optimize all relevance-critical elements to maximize relevance accuracy and ranking position."
relevance-optimization-ai,"Relevance Content Architecture","We structure content for relevance AI systems by implementing relevance-optimized content blocks, explicit relevance entity definitions, and relevance-ready content patterns. Relevance AI systems require clear, unambiguous relevance-optimized content structure to determine relevance accurately, so we optimize relevance content architecture for maximum relevance AI comprehension and relevance accuracy."
relevance-optimization-ai,"Relevance Structured Data Implementation","We implement relevance-specific structured data including comprehensive relevance entity definitions, explicit relevance relationships, and relevance AI signals. This includes relevance structured data (comprehensive relevance JSON-LD, explicit relevance entity definitions, relevance-specific markup), relevance entity optimization (explicit relevance entity definitions, clear relevance entity relationships, unambiguous relevance entity references), and relevance AI signals (relevance-specific structured data, relevance entity relationships, relevance entity clarity)."
relevance-optimization-ai,"Multi-Platform Relevance AI Optimization","We optimize content for relevance AI across multiple platforms (ChatGPT, Claude, Perplexity, Google AI Overviews) by implementing platform-agnostic relevance structured data and content patterns that work across all relevance AI engines. Each system has unique relevance requirements, so we ensure compatibility across all platforms while maximizing relevance accuracy and ranking position for each system."
schema-markup-ai,"Schema Markup Signal Engineering","We engineer schema markup signals that improve how AI systems understand and process your structured data. This includes schema markup optimization, explicit schema definitions, and schema AI signals. AI schema systems use specific signals to determine schema understanding, so we optimize all schema-critical elements to maximize schema comprehension and processing accuracy."
schema-markup-ai,"Schema Markup Implementation & Optimization","We implement comprehensive schema markup including explicit schema definitions, clear schema relationships, and schema AI signals. This includes schema markup optimization (explicit schema definitions, clear schema relationships, unambiguous schema references), schema AI signals (schema-specific structured data, schema entity relationships, schema entity clarity), and schema structured data (comprehensive schema JSON-LD, explicit schema entity definitions, schema-specific markup)."
schema-markup-ai,"AI Schema Markup Architecture","We structure schema markup for AI systems by implementing AI-optimized schema blocks, explicit schema entity definitions, and schema-ready markup patterns. AI schema systems require clear, unambiguous schema markup structure to process schema accurately, so we optimize schema architecture for maximum AI schema comprehension and processing accuracy."
schema-markup-ai,"Multi-Platform AI Schema Optimization","We optimize schema markup for multiple AI platforms (ChatGPT, Claude, Perplexity, Google AI Overviews) by implementing platform-agnostic schema structured data and markup patterns that work across all AI schema engines. Each system has unique schema requirements, so we ensure compatibility across all platforms while maximizing schema comprehension and processing accuracy for each system."
semantic-seo-ai,"Semantic Signal Engineering","We engineer semantic signals that improve how AI systems understand semantic relationships in your content. This includes semantic optimization, explicit semantic entity definitions, and semantic AI signals. Semantic AI systems use specific signals to determine semantic understanding, so we optimize all semantic-critical elements to maximize semantic comprehension and ranking position."
semantic-seo-ai,"Semantic Content Architecture & Optimization","We structure semantic content for AI systems by implementing atomic semantic content blocks, explicit semantic entity definitions, and semantic citation-ready content patterns. Semantic AI systems require clear, unambiguous semantic content structure to understand semantic relationships accurately, so we optimize semantic content architecture for maximum semantic AI comprehension and ranking position."
semantic-seo-ai,"Semantic Structured Data Implementation","We implement semantic-specific structured data including comprehensive semantic entity definitions, explicit semantic relationships, and semantic AI signals. This includes semantic structured data (comprehensive semantic JSON-LD, explicit semantic entity definitions, semantic-specific markup), semantic entity optimization (explicit semantic entity definitions, clear semantic entity relationships, unambiguous semantic entity references), and semantic AI signals (semantic-specific structured data, semantic entity relationships, semantic entity clarity)."
semantic-seo-ai,"Multi-Platform Semantic AI Optimization","We optimize semantic content for multiple AI platforms (ChatGPT, Claude, Perplexity, Google AI Overviews) by implementing platform-agnostic semantic structured data and content patterns that work across all semantic AI engines. Each system has unique semantic requirements, so we ensure compatibility across all platforms while maximizing semantic comprehension and ranking position for each system."
structured-data-ai,"Structured Data Signal Engineering","We engineer structured data signals that improve how AI systems understand and process your structured data. This includes structured data optimization, explicit structured data definitions, and structured data AI signals. AI structured data systems use specific signals to determine structured data understanding, so we optimize all structured data-critical elements to maximize structured data comprehension and processing accuracy."
structured-data-ai,"Structured Data Implementation & Optimization","We implement comprehensive structured data including explicit structured data definitions, clear structured data relationships, and structured data AI signals. This includes structured data optimization (explicit structured data definitions, clear structured data relationships, unambiguous structured data references), structured data AI signals (structured data-specific markup, structured data entity relationships, structured data entity clarity), and structured data markup (comprehensive structured data JSON-LD, explicit structured data entity definitions, structured data-specific markup)."
structured-data-ai,"AI Structured Data Architecture","We structure structured data for AI systems by implementing AI-optimized structured data blocks, explicit structured data entity definitions, and structured data-ready markup patterns. AI structured data systems require clear, unambiguous structured data structure to process structured data accurately, so we optimize structured data architecture for maximum AI structured data comprehension and processing accuracy."
