slug,type,name,short,description,price,currency,sku,brand,os,appCategory,delivery,subscription,availability,image_url,category,license_url,landing_url
crawl-clarity-engineering,service,Crawl Clarity Engineering,"Systematic URL normalization & canonical enforcement","Eliminate crawl budget waste with URL normalization, parameter stripping, and canonical enforcement for improved AI engine comprehension.",,USD,NRLC-SVC-001,NRLC.ai,,"",remote,"",InStock,https://nrlc.ai/assets/images/nrlcai logo 0.png,ProfessionalService,,https://nrlc.ai/services/crawl-clarity/
json-ld-strategy,service,JSON-LD & Structured Snippets,"Comprehensive schema markup implementation","Full structured data strategy with Organization, Service, LocalBusiness, and FAQPage schemas for maximum AI engine visibility.",,USD,NRLC-SVC-002,NRLC.ai,,"",remote,"",InStock,https://nrlc.ai/assets/images/nrlcai logo 1.png,ProfessionalService,,https://nrlc.ai/services/json-ld-strategy/
llm-seeding,service,LLM Seeding & Citation Readiness,"Content optimization for AI comprehension","Optimize content architecture, entity relationships, and semantic structure using GEO-16 framework principles for AI citation readiness.",,USD,NRLC-SVC-003,NRLC.ai,,"",remote,"",InStock,https://nrlc.ai/assets/images/nrlcai logo 2.png,ProfessionalService,,https://nrlc.ai/services/llm-seeding/
technical-seo,service,Technical SEO & Sitemaps,"Core web vitals & crawl efficiency","Foundational technical SEO addressing core web vitals, site speed, mobile optimization, and comprehensive sitemap implementation.",,USD,NRLC-SVC-004,NRLC.ai,,"",remote,"",InStock,https://nrlc.ai/assets/images/nrlcai logo 3.png,ProfessionalService,,https://nrlc.ai/services/technical-seo/
site-audits,service,AI-First Site Audits,"GEO-16 framework evaluation","Comprehensive audits evaluating content against GEO-16 framework pillars, structured data completeness, and AI engine visibility gaps.",,USD,NRLC-SVC-005,NRLC.ai,,"",remote,"",InStock,https://nrlc.ai/assets/images/nrlcai logo 4.png,ProfessionalService,,https://nrlc.ai/services/site-audits/
json-stream-seo-ai,software,JSON Stream + SEO AI,"NDJSON streaming API + AI manifest","Open source JSON streaming (NDJSON) utilities and AI manifests for LLM/RAG ingestion and internal crawlers.",,USD,NRLC-PROMPT-001,NRLC.ai,,"",download,"",InStock,https://nrlc.ai/assets/images/nrlcai logo 5.png,Software,https://opensource.org/licenses/MIT,https://nrlc.ai/promptware/json-stream-seo-ai/
llm-data-to-citation,software,LLM Data-to-Citation Guide,"Schema & NDJSON citation playbook","Practical guide for turning your site's schema and NDJSON into citations inside LLM answers and AI Overviews.",,USD,NRLC-PROMPT-002,NRLC.ai,,"",download,"",InStock,https://nrlc.ai/assets/images/nrlcai logo 6.png,Software,https://opensource.org/licenses/MIT,https://nrlc.ai/promptware/llm-data-to-citation/
